{
  "$schema": "../../../../docs/packs/schema/curriculum-unit.schema.json",
  "id": "u35",
  "color": "blush",
  "character": "amara",
  "words": ["enfumo", "olwatuuka", "olwali-olumu", "waaliwo", "awo", "nagenda", "nalaba", "nagamba", "ekyavaamu", "kale-nno", "enfumo-ewedde"],
  "sentences": [
    "s35-olwatuuka",
    "s35-waaliwo-omusajja",
    "s35-waaliwo-omukazi",
    "s35-nagenda-mu-kibira",
    "s35-nalaba-empologoma",
    "s35-nagamba",
    "s35-ekyavaamu",
    "s35-kale-nno",
    "s35-enfumo-ekomye"
  ],
  "phrases": 6,
  "skills": [
    {
      "id": "u35s1",
      "icon": "book",
      "lessons": [
        { "id": "u35s1l1", "newWords": ["enfumo", "olwatuuka", "olwali-olumu"], "sentences": ["s35-olwatuuka", "s35-kale-nno"] },
        { "id": "u35s1l2", "newWords": ["waaliwo"], "sentences": ["s35-waaliwo-omusajja", "s35-waaliwo-omukazi"] },
        { "id": "u35s1l3", "newWords": ["kale-nno"], "sentences": ["s35-kale-nno", "s35-olwatuuka", "s35-waaliwo-omusajja"] }
      ]
    },
    {
      "id": "u35s2",
      "icon": "arrow",
      "lessons": [
        { "id": "u35s2l1", "newWords": ["awo", "nagenda"], "sentences": ["s35-nagenda-mu-kibira"] },
        { "id": "u35s2l2", "newWords": ["nalaba"], "sentences": ["s35-nalaba-empologoma", "s35-nagenda-mu-kibira"] },
        { "id": "u35s2l3", "newWords": ["nagamba"], "sentences": ["s35-nagamba", "s35-nalaba-empologoma"] }
      ]
    },
    {
      "id": "u35s3",
      "icon": "check",
      "lessons": [
        { "id": "u35s3l1", "newWords": ["ekyavaamu"], "sentences": ["s35-ekyavaamu"] },
        { "id": "u35s3l2", "newWords": ["enfumo-ewedde"], "sentences": ["s35-enfumo-ekomye", "s35-ekyavaamu"] },
        {
          "id": "u35s3l3",
          "newWords": [],
          "sentences": ["s35-olwatuuka", "s35-nagenda-mu-kibira", "s35-nalaba-empologoma", "s35-enfumo-ekomye"],
          "dialogues": [{ "speaker": "amara", "answer": 0 }]
        }
      ]
    }
  ],
  "stories": [
    {
      "id": "amaras-story",
      "unlockAfter": "u35s3l3",
      "cast": ["amara", "emma"],
      "steps": [
        { "speaker": "emma" },
        { "speaker": "amara" },
        { "speaker": "amara" },
        { "answer": 0 },
        { "speaker": "emma" },
        { "speaker": "amara" },
        { "speaker": "emma" },
        { "speaker": "amara" },
        { "answer": 1 },
        { "speaker": "amara" },
        { "speaker": "amara" },
        { "answer": 0, "optionsLang": "target" }
      ]
    }
  ]
}
