{
  "$schema": "../../../../docs/packs/schema/curriculum-unit.schema.json",
  "id": "u30",
  "color": "sage",
  "character": "mukasa",
  "words": [
    "katonda",
    "okusaba",
    "nsaba",
    "bbayibuli",
    "kulaani",
    "amiina",
    "ssekukkulu",
    "paasika",
    "iddi",
    "okusiiba",
    "abajulizi",
    "omukisa",
    "akuwe",
    "omwaka-omuggya",
    "sikukuu",
    "dini",
    "ramadhani",
    "alizaliwa",
    "anaitwa",
    "mungu-akubariki"
  ],
  "sentences": [
    "s30-tusaba-katonda",
    "s30-ssabbiiti-ekkanisa",
    "s30-lwakutaano-omuzigiti",
    "s30-nsaba-amazzi",
    "s30-bbayibuli-kulaani",
    "s30-ssekukkulu-ennungi",
    "s30-omwaka-omuggya",
    "s30-paasika",
    "s30-iddi",
    "s30-okusiiba",
    "s30-abajulizi",
    "s30-katonda-akuwe-omukisa",
    "s30-amiina",
    "s-sikukuu-kesho",
    "s-idi",
    "s-krismasi",
    "s-dini",
    "s-kusali-msikitini",
    "s-kusali-kanisani",
    "s-ramadhani",
    "s-baraka",
    "s-alizaliwa",
    "s-anaitwa",
    "s-akubariki"
  ],
  "phrases": 6,
  "skills": [
    {
      "id": "u30s1",
      "icon": "home",
      "lessons": [
        { "id": "u30s1l1", "newWords": ["katonda", "okusaba"], "sentences": ["s30-tusaba-katonda", "s30-ssabbiiti-ekkanisa"] },
        { "id": "u30s1l2", "newWords": ["nsaba"], "sentences": ["s30-nsaba-amazzi", "s30-lwakutaano-omuzigiti"] },
        { "id": "u30s1l3", "newWords": ["bbayibuli", "kulaani"], "sentences": ["s30-bbayibuli-kulaani", "s30-lwakutaano-omuzigiti"] }
      ]
    },
    {
      "id": "u30s2",
      "icon": "gem",
      "lessons": [
        { "id": "u30s2l1", "newWords": ["ssekukkulu", "omwaka-omuggya"], "sentences": ["s30-ssekukkulu-ennungi", "s30-omwaka-omuggya"] },
        { "id": "u30s2l2", "newWords": ["paasika", "iddi", "okusiiba"], "sentences": ["s30-paasika", "s30-iddi", "s30-okusiiba"] },
        { "id": "u30s2l3", "newWords": ["abajulizi"], "sentences": ["s30-abajulizi", "s30-ssekukkulu-ennungi"] }
      ]
    },
    {
      "id": "u30s3",
      "icon": "heart",
      "lessons": [
        { "id": "u30s3l1", "newWords": ["omukisa", "akuwe"], "sentences": ["s30-katonda-akuwe-omukisa"] },
        { "id": "u30s3l2", "newWords": ["amiina"], "sentences": ["s30-amiina", "s30-katonda-akuwe-omukisa"] },
        {
          "id": "u30s3l3",
          "newWords": [],
          "sentences": ["s30-iddi", "s30-omwaka-omuggya", "s30-tusaba-katonda"],
          "dialogues": [{ "speaker": "mukasa", "answer": 0 }]
        }
      ]
    },
    {
      "id": "u30s4",
      "icon": "star",
      "since": 2,
      "lessons": [
        { "id": "u30s4l1", "newWords": ["sikukuu", "dini"], "sentences": ["s-sikukuu-kesho", "s-idi", "s-krismasi", "s-dini"] },
        {
          "id": "u30s4l2",
          "newWords": ["ramadhani", "alizaliwa", "anaitwa", "mungu-akubariki"],
          "sentences": ["s-kusali-msikitini", "s-kusali-kanisani", "s-ramadhani", "s-baraka", "s-alizaliwa", "s-anaitwa", "s-akubariki"]
        }
      ]
    }
  ],
  "stories": [
    {
      "id": "sw-ramadan-evening",
      "unlockAfter": "u30s4l2",
      "cast": ["jjajja", "emma"],
      "culture": "sw",
      "steps": [
        { "speaker": "emma" },
        { "speaker": "jjajja" },
        { "answer": 0 },
        { "speaker": "emma" },
        { "speaker": "jjajja" },
        { "answer": 0 },
        { "speaker": "emma" },
        { "speaker": "jjajja" },
        { "answer": 0, "optionsLang": "target" }
      ]
    }
  ]
}
